<?xml version="1.0" encoding="UTF-8"?>
<Module xmlns:xsi='http://www.w3.org/2001/XMLSchema-instance'
        xsi:noNamespaceSchemaLocation="SubModule.xsd" >
  <Id value="$moduleid$" />
  <Name value="$modulename$" />
  <Version value="v$version$" />
  <DefaultModule value="false" />
  <ModuleCategory value="Singleplayer"/>
  <ModuleType value="Community" />
  <Url value="$moduleurl$" />
  <DependedModules>
    <DependedModule Id="Bannerlord.Harmony" DependentVersion="v$harmonyversion$" />
    <DependedModule Id="Bannerlord.ButterLib" DependentVersion="v$butterlibversion$" />
    <DependedModule Id="Bannerlord.MBOptionScreen" DependentVersion="v$mcmversion$" />
    <DependedModule Id="Native" DependentVersion="$gameversion$" />
    <DependedModule Id="SandBoxCore" DependentVersion="$gameversion$" />
    <DependedModule Id="Sandbox" DependentVersion="$gameversion$" />
    <DependedModule Id="StoryMode" DependentVersion="$gameversion$" />
  </DependedModules>
  <!-- Community Dependency Metadata -->
  <!-- https://github.com/BUTR/Bannerlord.BLSE#community-dependency-metadata -->
  <DependedModuleMetadatas>
    <DependedModuleMetadata id="Bannerlord.Harmony" order="LoadBeforeThis" version="v$harmonyversion$" />
    <DependedModuleMetadata id="Bannerlord.ButterLib" order="LoadBeforeThis" version="v$butterlibversion$" />
    <DependedModuleMetadata id="Bannerlord.MBOptionScreen" order="LoadBeforeThis" version="v$mcmversion$" />
    <DependedModuleMetadata id="Native" order="LoadBeforeThis" version="$gameversion$.*" />
    <DependedModuleMetadata id="SandBoxCore" order="LoadBeforeThis" version="$gameversion$.*" />
    <DependedModuleMetadata id="Sandbox" order="LoadBeforeThis" version="$gameversion$.*" />
    <DependedModuleMetadata id="StoryMode" order="LoadBeforeThis" version="$gameversion$.*" />
  </DependedModuleMetadatas>
  <SubModules>
    <!-- Bannerlord Module Loader. Do not change the name! -->
    <SubModule>
      <Name value="Bannerlord Module Loader" />
      <DLLName value="Bannerlord.ModuleLoader.$moduleid$.dll" />
      <SubModuleClassType value="Bannerlord.ModuleLoader.$moduleid$" />
      <Assemblies/>
      <Tags>
        <Tag key="LoaderFilter" value ="$moduleid$.*.dll" />
      </Tags>
    </SubModule>
  </SubModules>
</Module>